{
  "schemaVersion": "2.0",
  "coreVersion": "2.0",
  "sourceTool": "fixture",
  "sourceVersion": "1.0",
  "exportedAt": "2026-10-12T00:00:00Z",
  "workType": "nonfiction",
  "novelData": {
    "title": "Authorization Test"
  },
  "providerConfig": {
    "endpoint": "******provider.example.test/v1"
  },
  "ext": {
    "futureTool": {
      "headers": {
        "Authorization": "******"
      }
    }
  }
}
