{
  "schemaVersion": "2.0",
  "coreVersion": "2.0",
  "sourceTool": "fixture",
  "sourceVersion": "test",
  "exportedAt": "2026-10-13T00:00:00Z",
  "workType": "nonfiction",
  "novelData": {},
  "ext": {
    "futureTool": {
      "plainHttps": "https://example.test/book",
      "page": "https://example.test/book?page=2",
      "keywords": "https://example.test/book?keywords=x",
      "tokens": "https://example.test/book?tokens=5",
      "mail": "mailto:reader@example.test",
      "pathAt": "https://example.test/books/@reader",
      "keyAndTerm": "https://example.test/book?key=abc&term=echinacea",
      "sheet": "https://example.test/book?key=<sheet id>",
      "pubmed": "https://pubmed.ncbi.nlm.nih.gov/?term=valerian+sleep",
      "doi": "https://doi.org/10.1016/x"
    }
  }
}
