{
  "schemaVersion": "2.0",
  "coreVersion": "2.0",
  "sourceTool": "NovelWriter",
  "sourceVersion": "2.0",
  "exportedAt": "2026-10-12T00:00:00Z",
  "workType": "fiction",
  "novelData": {
    "title": "The Lantern Atlas",
    "story": {
      "book": {
        "id": "bk_lantern_atlas",
        "title": "The Lantern Atlas"
      },
      "chapters": [],
      "scenes": [
        {
          "id": "sc_bad_source",
          "chapterId": "ch_arrival",
          "order": 1,
          "breakApproved": false,
          "source": "model"
        }
      ]
    }
  }
}
